{
    "$schema": "http://json-schema.org/draft-04/schema#",
    "id": "https://schema.humancellatlas.org/bundle/1.0.0/reference",
    "description": "A schema for a reference bundle.",
    "additionalProperties": false,
    "required": [
        "describedBy",
        "schema_type"
    ],
    "title": "reference",
    "type": "object",
    "definitions": {
        "reference_ingest": {
            "required": [
                "hca_ingest",
                "content"
            ],
            "type": "object",
            "properties": {
                "hca_ingest": {
                    "description": "Core fields added by HCA ingest service",
                    "type": "object",
                    "$ref": "https://schema.humancellatlas.org/bundle/5.0.0/ingest_audit"
                },
                "content": {
                    "description": "Content for any reference type entity.",
                    "type": "object",
                    "$ref": "https://schema.humancellatlas.org/type/file/5.0.0/reference_file"
                }
            }
        }
    },
    "properties": {
        "describedBy" : {
            "description": "The URL reference to the schema.",
            "type": "string",
            "pattern" : "https://schema.humancellatlas.org/bundle/[0-9]{1,}.[0-9]{1,}.[0-9]{1,}/reference"
        },
        "schema_version": {
            "description": "The version number of the schema in major.minor.patch format.",
            "type": "string",
            "pattern": "^[0-9]{1,}.[0-9]{1,}.[0-9]{1,}$"
        },
        "schema_type": {
            "description": "The type of the metadata schema entity.",
            "type": "string",
            "enum": [
                "reference_bundle"
            ]
        },
        "references": {
            "description": "An array of reference files.",
            "type": "array",
            "items": {
                "$ref": "https://schema.humancellatlas.org/bundle/1.0.0/reference#/definitions/reference_ingest"
            }
        }
    }
}